{
  "collected_at": "2026-09-09T10:00:00+00:00",
  "collection_started_at": "2026-09-09T10:00:00+00:00",
  "jobs": [
    {
      "allow_failure": false,
      "created_at": "2026-09-08T10:00:00+00:00",
      "duration_seconds": 47,
      "failure_reason": null,
      "finished_at": "2026-09-08T10:05:57+00:00",
      "id": 1084,
      "name": "security_scan",
      "pipeline_id": 108,
      "queued_seconds": 3,
      "ref": "main",
      "runner": {
        "description": "demo-runner",
        "id": 1
      },
      "stage": "test",
      "started_at": "2026-09-08T10:05:10+00:00",
      "status": "success",
      "web_url": "https://gitlab.example.com/example/demo-service/-/jobs/1084"
    },
    {
      "allow_failure": false,
      "created_at": "2026-09-08T10:00:00+00:00",
      "duration_seconds": 324,
      "failure_reason": null,
      "finished_at": "2026-09-08T10:10:41+00:00",
      "id": 1083,
      "name": "integration_tests",
      "pipeline_id": 108,
      "queued_seconds": 10,
      "ref": "main",
      "runner": {
        "description": "demo-runner",
        "id": 1
      },
      "stage": "test",
      "started_at": "2026-09-08T10:05:17+00:00",
      "status": "success",
      "web_url": "https://gitlab.example.com/example/demo-service/-/jobs/1083"
    },
    {
      "allow_failure": false,
      "created_at": "2026-09-08T10:00:00+00:00",
      "duration_seconds": 32,
      "failure_reason": null,
      "finished_at": "2026-09-08T10:05:41+00:00",
      "id": 1082,
      "name": "lint",
      "pipeline_id": 108,
      "queued_seconds": 2,
      "ref": "main",
      "runner": {
        "description": "demo-runner",
        "id": 1
      },
      "stage": "test",
      "started_at": "2026-09-08T10:05:09+00:00",
      "status": "success",
      "web_url": "https://gitlab.example.com/example/demo-service/-/jobs/1082"
    },
    {
      "allow_failure": false,
      "created_at": "2026-09-08T10:00:00+00:00",
      "duration_seconds": 900,
      "failure_reason": null,
      "finished_at": "2026-09-08T10:20:19+00:00",
      "id": 1081,
      "name": "unit_tests",
      "pipeline_id": 108,
      "queued_seconds": 12,
      "ref": "main",
      "runner": {
        "description": "demo-runner",
        "id": 1
      },
      "stage": "test",
      "started_at": "2026-09-08T10:05:19+00:00",
      "status": "success",
      "web_url": "https://gitlab.example.com/example/demo-service/-/jobs/1081"
    },
    {
      "allow_failure": false,
      "created_at": "2026-09-08T10:00:00+00:00",
      "duration_seconds": 127,
      "failure_reason": null,
      "finished_at": "2026-09-08T10:05:07+00:00",
      "id": 1080,
      "name": "build",
      "pipeline_id": 108,
      "queued_seconds": 180,
      "ref": "main",
      "runner": {
        "description": "demo-runner",
        "id": 1
      },
      "stage": "build",
      "started_at": "2026-09-08T10:03:00+00:00",
      "status": "success",
      "web_url": "https://gitlab.example.com/example/demo-service/-/jobs/1080"
    },
    {
      "allow_failure": false,
      "created_at": "2026-09-07T10:00:00+00:00",
      "duration_seconds": 46,
      "failure_reason": null,
      "finished_at": "2026-09-07T10:03:06+00:00",
      "id": 1074,
      "name": "security_scan",
      "pipeline_id": 107,
      "queued_seconds": 3,
      "ref": "main",
      "runner": {
        "description": "demo-runner",
        "id": 1
      },
      "stage": "test",
      "started_at": "2026-09-07T10:02:20+00:00",
      "status": "success",
      "web_url": "https://gitlab.example.com/example/demo-service/-/jobs/1074"
    },
    {
      "allow_failure": false,
      "created_at": "2026-09-07T10:00:00+00:00",
      "duration_seconds": 322,
      "failure_reason": null,
      "finished_at": "2026-09-07T10:07:49+00:00",
      "id": 1073,
      "name": "integration_tests",
      "pipeline_id": 107,
      "queued_seconds": 10,
      "ref": "main",
      "runner": {
        "description": "demo-runner",
        "id": 1
      },
      "stage": "test",
      "started_at": "2026-09-07T10:02:27+00:00",
      "status": "success",
      "web_url": "https://gitlab.example.com/example/demo-service/-/jobs/1073"
    },
    {
      "allow_failure": false,
      "created_at": "2026-09-07T10:00:00+00:00",
      "duration_seconds": 31,
      "failure_reason": null,
      "finished_at": "2026-09-07T10:02:50+00:00",
      "id": 1072,
      "name": "lint",
      "pipeline_id": 107,
      "queued_seconds": 2,
      "ref": "main",
      "runner": {
        "description": "demo-runner",
        "id": 1
      },
      "stage": "test",
      "started_at": "2026-09-07T10:02:19+00:00",
      "status": "success",
      "web_url": "https://gitlab.example.com/example/demo-service/-/jobs/1072"
    },
    {
      "allow_failure": false,
      "created_at": "2026-09-07T10:00:00+00:00",
      "duration_seconds": 228,
      "failure_reason": null,
      "finished_at": "2026-09-07T10:06:16+00:00",
      "id": 1071,
      "name": "unit_tests",
      "pipeline_id": 107,
      "queued_seconds": 11,
      "ref": "main",
      "runner": {
        "description": "demo-runner",
        "id": 1
      },
      "stage": "test",
      "started_at": "2026-09-07T10:02:28+00:00",
      "status": "success",
      "web_url": "https://gitlab.example.com/example/demo-service/-/jobs/1071"
    },
    {
      "allow_failure": false,
      "created_at": "2026-09-07T10:00:00+00:00",
      "duration_seconds": 126,
      "failure_reason": null,
      "finished_at": "2026-09-07T10:02:17+00:00",
      "id": 1070,
      "name": "build",
      "pipeline_id": 107,
      "queued_seconds": 11,
      "ref": "main",
      "runner": {
        "description": "demo-runner",
        "id": 1
      },
      "stage": "build",
      "started_at": "2026-09-07T10:00:11+00:00",
      "status": "success",
      "web_url": "https://gitlab.example.com/example/demo-service/-/jobs/1070"
    },
    {
      "allow_failure": false,
      "created_at": "2026-09-06T10:00:00+00:00",
      "duration_seconds": 45,
      "failure_reason": null,
      "finished_at": "2026-09-06T10:03:03+00:00",
      "id": 1064,
      "name": "security_scan",
      "pipeline_id": 106,
      "queued_seconds": 3,
      "ref": "main",
      "runner": {
        "description": "demo-runner",
        "id": 1
      },
      "stage": "test",
      "started_at": "2026-09-06T10:02:18+00:00",
      "status": "success",
      "web_url": "https://gitlab.example.com/example/demo-service/-/jobs/1064"
    },
    {
      "allow_failure": false,
      "created_at": "2026-09-06T10:00:00+00:00",
      "duration_seconds": 320,
      "failure_reason": null,
      "finished_at": "2026-09-06T10:07:45+00:00",
      "id": 1063,
      "name": "integration_tests",
      "pipeline_id": 106,
      "queued_seconds": 10,
      "ref": "main",
      "runner": {
        "description": "demo-runner",
        "id": 1
      },
      "stage": "test",
      "started_at": "2026-09-06T10:02:25+00:00",
      "status": "success",
      "web_url": "https://gitlab.example.com/example/demo-service/-/jobs/1063"
    },
    {
      "allow_failure": false,
      "created_at": "2026-09-06T10:00:00+00:00",
      "duration_seconds": 30,
      "failure_reason": null,
      "finished_at": "2026-09-06T10:02:47+00:00",
      "id": 1062,
      "name": "lint",
      "pipeline_id": 106,
      "queued_seconds": 2,
      "ref": "main",
      "runner": {
        "description": "demo-runner",
        "id": 1
      },
      "stage": "test",
      "started_at": "2026-09-06T10:02:17+00:00",
      "status": "success",
      "web_url": "https://gitlab.example.com/example/demo-service/-/jobs/1062"
    },
    {
      "allow_failure": false,
      "created_at": "2026-09-06T10:00:00+00:00",
      "duration_seconds": 225,
      "failure_reason": null,
      "finished_at": "2026-09-06T10:06:10+00:00",
      "id": 1061,
      "name": "unit_tests",
      "pipeline_id": 106,
      "queued_seconds": 10,
      "ref": "main",
      "runner": {
        "description": "demo-runner",
        "id": 1
      },
      "stage": "test",
      "started_at": "2026-09-06T10:02:25+00:00",
      "status": "success",
      "web_url": "https://gitlab.example.com/example/demo-service/-/jobs/1061"
    },
    {
      "allow_failure": false,
      "created_at": "2026-09-06T10:00:00+00:00",
      "duration_seconds": 125,
      "failure_reason": null,
      "finished_at": "2026-09-06T10:02:15+00:00",
      "id": 1060,
      "name": "build",
      "pipeline_id": 106,
      "queued_seconds": 10,
      "ref": "main",
      "runner": {
        "description": "demo-runner",
        "id": 1
      },
      "stage": "build",
      "started_at": "2026-09-06T10:00:10+00:00",
      "status": "success",
      "web_url": "https://gitlab.example.com/example/demo-service/-/jobs/1060"
    },
    {
      "allow_failure": false,
      "created_at": "2026-09-05T10:00:00+00:00",
      "duration_seconds": 44,
      "failure_reason": null,
      "finished_at": "2026-09-05T10:03:00+00:00",
      "id": 1054,
      "name": "security_scan",
      "pipeline_id": 105,
      "queued_seconds": 3,
      "ref": "main",
      "runner": {
        "description": "demo-runner",
        "id": 1
      },
      "stage": "test",
      "started_at": "2026-09-05T10:02:16+00:00",
      "status": "success",
      "web_url": "https://gitlab.example.com/example/demo-service/-/jobs/1054"
    },
    {
      "allow_failure": false,
      "created_at": "2026-09-05T10:00:00+00:00",
      "duration_seconds": 318,
      "failure_reason": null,
      "finished_at": "2026-09-05T10:07:41+00:00",
      "id": 1053,
      "name": "integration_tests",
      "pipeline_id": 105,
      "queued_seconds": 10,
      "ref": "main",
      "runner": {
        "description": "demo-runner",
        "id": 1
      },
      "stage": "test",
      "started_at": "2026-09-05T10:02:23+00:00",
      "status": "success",